Risk Description,Likelihood,Impact,Risk Level,Mitigation Strategy
Development Delays,Moderate,High,High,Regular progress tracking and communication
UI Design Changes,Low,Medium,Low,Clearly defined design requirements
Market Strategy Ineffectiveness,High,High,High,Extensive market research and testing
Inadequate Testing,Moderate,High,High,Comprehensive QA and testing plan
User Acceptance Challenges,Low,Medium,Low,Involvement of users in design and testing
Post-Launch Bugs,Moderate,Medium,Moderate,Ongoing post-launch monitoring and updates
